{
  "schema_id": "dftlab.physical-model",
  "schema_version": "0.1.0",
  "record_id": "rec-physical-model",
  "project_id": "prj-demo",
  "producer": {
    "package": "dftlab-platform",
    "version": "0.1.0",
    "commit": null,
    "algorithm": null
  },
  "created_at": "2026-10-11T05:00:00Z",
  "payload": {
    "xc": {
      "functional": "PBE",
      "family": "GGA"
    },
    "total_charge": {
      "value": 0,
      "unit": "e"
    },
    "spin": "NONE",
    "relativistic": "SCALAR",
    "hubbard": {
      "quantity_kind": "U_scalar_charge",
      "subspaces": [
        {
          "species_label": "Ni",
          "orbital": "3d",
          "value": {
            "value": "6.12",
            "unit": "eV"
          }
        }
      ],
      "source": {
        "engine": "hubbardflow",
        "distribution": "dftlab-hubbard",
        "version": "0.1.2",
        "commit": "e508f47aff1c6243deabb12915063b6b9d899d65",
        "contract": "hubbardflow.resolved-perturbation-plan@1.0",
        "digest": {
          "algorithm": "hubbardflow.plan-digest-v1",
          "value": "a7034a324d4b09577497bd4e6a3acc82e472120e4958ec00b75cf40e69e5bbd6"
        },
        "artifact": {
          "artifact_id": "art-lr-plan",
          "sha256": "041dc84fe6db647a1ce190ee7188330eb1fc1a308a521a21610f7a7bcf7573db",
          "media_type": "application/json"
        },
        "verification": {
          "status": "VERIFIED",
          "verified_at": "2026-10-11T05:00:00Z"
        }
      }
    },
    "assumptions": []
  },
  "native_contract_refs": [],
  "integrity": {
    "status": "UNVERIFIED",
    "canonicalization": "jcs-rfc8785",
    "algorithm": "sha-256",
    "digest": null
  }
}
