{
  "schema_id": "dftlab.effect-intent",
  "schema_version": "0.1.0",
  "record_id": "rec-effect-intent",
  "project_id": "prj-demo",
  "producer": {
    "package": "dftlab-platform",
    "version": "0.1.0",
    "commit": null,
    "algorithm": null
  },
  "created_at": "2026-10-11T05:00:00Z",
  "payload": {
    "effect_intent_id": "eff-1",
    "operation_id": "op-1",
    "action": "SUBMIT_RUN",
    "run_id": "run-1",
    "attempt_id": "att-1",
    "attempt_token": "3f2b8c1e-9a4d-4c7e-8b21-5d6f7a8b9c0d",
    "package_ref": {
      "artifact_id": "art-pkg.zip",
      "sha256": "5f2059a48ccb06e6ce321cb8472b263967def87373f702bf6798eb1b8bc306de",
      "media_type": "application/zip"
    },
    "profile": {
      "profile_id": "prof-hpc",
      "revision": 2
    },
    "scheduler": "SLURM",
    "authority_generation": 1,
    "recorded_at": "2026-10-11T05:00:00Z"
  },
  "native_contract_refs": [],
  "integrity": {
    "status": "UNVERIFIED",
    "canonicalization": "jcs-rfc8785",
    "algorithm": "sha-256",
    "digest": null
  }
}
