{"created_at":"2026-10-15T06:27:31.186570Z","integrity":{"algorithm":"sha-256","canonicalization":"jcs-rfc8785","digest":"d877dddd961fa8178067c90b788d0524b8eb34aee77320475230e0a692dbfb2c","status":"VERIFIED"},"native_contract_refs":[],"payload":{"capabilities":["MPI_BINARY_AVAILABLE"],"executable":{"build":"mpi","name":"siesta","sha256":"aaa9a2e45a41b12f3aad52ca4fca7c25b1cc6afd3aff2a0c7fe145b1bd9f18ce","version":"5.4.2"},"launcher":{"kind":"openmpi","mpi":true,"ranks":4,"threads_per_rank":1},"observed_at":"2026-10-15T06:27:30.404818Z","profile":{"profile_id":"wsl-slurm-openmpi-installed-qualification","revision":1},"storage_checks":[{"check":"PRIVATE_LOCAL_STORAGE","result":"PASS"},{"check":"FILE_FSYNC","result":"PASS"},{"check":"ATOMIC_RENAME","result":"PASS"},{"check":"DIRECTORY_FSYNC","result":"PASS"},{"check":"PARTITION_NODE_CAPACITY","result":"PASS"},{"check":"MPI_RANK_EXECUTION","result":"NOT_ESTABLISHED"},{"check":"MODULES_REQUIRED","result":"NOT_ESTABLISHED"}],"valid_until":"2026-10-15T06:42:30.404818Z"},"producer":{"algorithm":null,"commit":null,"package":"dftlab-platform","version":"0.1.0-dev.0"},"project_id":"513700c8-095a-48fe-832f-80ae9c16eb03","record_id":"1bc1271b-b566-49c8-90e7-00810613778b","schema_id":"dftlab.runtime-probe-receipt","schema_version":"0.1.0"}