{
  "schema_id": "dftlab.assessment-record",
  "schema_version": "0.1.0",
  "record_id": "rec-assessment-record",
  "project_id": "prj-demo",
  "producer": {
    "package": "dftlab-platform",
    "version": "0.1.0",
    "commit": null,
    "algorithm": null
  },
  "created_at": "2026-10-11T05:00:00Z",
  "payload": {
    "assessment_id": "as-1",
    "subject_refs": [
      "run-1"
    ],
    "assessment_type": "hubbard.lr-response",
    "protocol": {
      "policy_id": "hubbardflow.lr-protocol",
      "version": "0.1.2",
      "digest": "2697c21c5a76cc729478fe185cd947e7cf57826f9f7c3b6787ad3f58bdc5a3da"
    },
    "rule": "plan coverage",
    "native_status": {
      "authority": "hubbardflow",
      "vocabulary": "hubbardflow.PlanStatus",
      "value": "NOT_ESTABLISHED"
    },
    "passport_state": "NOT_ESTABLISHED",
    "reasons": [
      "Evidencia SCF adicional ausente."
    ],
    "evidence": [
      {
        "engine": "hubbardflow",
        "distribution": "dftlab-hubbard",
        "version": "0.1.2",
        "commit": "e508f47aff1c6243deabb12915063b6b9d899d65",
        "contract": "hubbardflow.resolved-perturbation-plan@1.0",
        "digest": {
          "algorithm": "hubbardflow.plan-digest-v1",
          "value": "a7034a324d4b09577497bd4e6a3acc82e472120e4958ec00b75cf40e69e5bbd6"
        },
        "artifact": {
          "artifact_id": "art-lr-plan",
          "sha256": "041dc84fe6db647a1ce190ee7188330eb1fc1a308a521a21610f7a7bcf7573db",
          "media_type": "application/json"
        },
        "verification": {
          "status": "VERIFIED",
          "verified_at": "2026-10-11T05:00:00Z"
        }
      }
    ],
    "scope": "Ni 3d, plan lr-plan",
    "supersedes": null,
    "quantity_semantics": {
      "quantity_kind": "U_scalar_charge",
      "usable_as": [
        "U_scalar_charge"
      ]
    }
  },
  "native_contract_refs": [],
  "integrity": {
    "status": "UNVERIFIED",
    "canonicalization": "jcs-rfc8785",
    "algorithm": "sha-256",
    "digest": null
  }
}
