{"created_at":"2026-10-15T06:27:31.245745Z","integrity":{"algorithm":"sha-256","canonicalization":"jcs-rfc8785","digest":"ca780f823f077070772e066bd41d3ca724c161efd1cfd1cc2e5cfb70afcb9fc1","status":"VERIFIED"},"native_contract_refs":[],"payload":{"action":"SUBMIT_RUN","decision":"ADMITTED","expires_at":"2026-10-15T06:42:30.404818Z","package_digest":"65ac213fe58a10da856ee826f1207f07796ed6256eb1e7aac271e831891e0eec","plan_digest":"003cbdb2f56129fd4a7a5c617b1eeeb78ced4550c790a74134412f5de290882a","preconditions":[{"expected":"2","kind":"PLAN_REVISION"}],"principal_id":"35c8bcaa-dfa8-40a8-90d9-0a2f81d7e082","profile":{"profile_id":"wsl-slurm-openmpi-installed-qualification","revision":1},"purpose":"EXPLORATORY","qualification_refs":[],"reasons":["EXPLORATORY_SCIENCE_NOT_ESTABLISHED"],"reservation":{"amount":{"unit":"allocated_cpu_second","value":480},"budget_ref":"5ce444c1-a49c-4549-b423-335038ba4137","reservation_id":"9d1f410c-9371-4c82-966e-2648ec71e5e0"},"runtime_probe_ref":"cc29b3c6-7f6c-4ced-b6eb-b8a3ec1344f4"},"producer":{"algorithm":null,"commit":null,"package":"dftlab-platform","version":"0.1.0-dev.0"},"project_id":"513700c8-095a-48fe-832f-80ae9c16eb03","record_id":"57a33e0f-083f-4e69-b625-7a47034cef56","schema_id":"dftlab.admission-receipt","schema_version":"0.1.0"}