{
  "schema_id": "dftlab.campaign",
  "schema_version": "0.1.0",
  "record_id": "rec-campaign",
  "project_id": "prj-demo",
  "producer": {
    "package": "dftlab-platform",
    "version": "0.1.0",
    "commit": null,
    "algorithm": null
  },
  "created_at": "2026-10-11T05:00:00Z",
  "payload": {
    "campaign_id": "cmp-1",
    "revision": 1,
    "name": "EOS Si",
    "drafts": [
      {
        "draft_id": "drf-1",
        "revision": 2
      }
    ]
  },
  "native_contract_refs": [],
  "integrity": {
    "status": "UNVERIFIED",
    "canonicalization": "jcs-rfc8785",
    "algorithm": "sha-256",
    "digest": null
  }
}
