{
  "schema_id": "dftlab.learning-dataset",
  "schema_version": "0.1.0",
  "record_id": "rec-learning-dataset",
  "project_id": "prj-demo",
  "producer": {
    "package": "dftlab-platform",
    "version": "0.1.0",
    "commit": null,
    "algorithm": null
  },
  "created_at": "2026-10-11T05:00:00Z",
  "payload": {
    "dataset_id": "ld-si",
    "title": "Si diamante",
    "description": "Corrida real usada en Aprender.",
    "classification": {
      "origin": "BUILTIN_EXAMPLE",
      "purpose": "EDUCATIONAL",
      "provenance_state": "VERIFIED",
      "provenance_evidence": [
        {
          "artifact_id": "art-si.out",
          "sha256": "2aab92592a006d9049d224b27e6724338344b1aca6797fd9779938ecc085efb9",
          "media_type": "text/plain"
        }
      ],
      "scientific_assessment": {
        "state": "NOT_EVALUATED",
        "assessment_refs": []
      }
    },
    "license": {
      "spdx": "CC-BY-4.0",
      "text": null
    },
    "references": [],
    "files": [
      {
        "path": "data/si/bands.json",
        "sha256": "e9ad81590ff548f515057a4d623ae63252775ff261342c3b9b51632d477c90eb",
        "media_type": "application/json"
      }
    ]
  },
  "native_contract_refs": [],
  "integrity": {
    "status": "UNVERIFIED",
    "canonicalization": "jcs-rfc8785",
    "algorithm": "sha-256",
    "digest": null
  }
}
