{
  "schema_id": "dftlab.admission-receipt",
  "schema_version": "0.1.0",
  "record_id": "rec-admission-receipt",
  "project_id": "prj-demo",
  "producer": {
    "package": "dftlab-platform",
    "version": "0.1.0",
    "commit": null,
    "algorithm": null
  },
  "created_at": "2026-10-11T05:00:00Z",
  "payload": {
    "principal_id": "u-1",
    "action": "SUBMIT_RUN",
    "purpose": "EXPLORATORY",
    "plan_digest": "64879f7d6b960a01909762d911a32d4582c20010c5641ee90278b644a9e3b525",
    "package_digest": "e0ce1a7f3f76d7bfda0ffdae6e0226aa63b3009c4c4a770c321876aecad0a6c1",
    "profile": {
      "profile_id": "prof-hpc",
      "revision": 2
    },
    "qualification_refs": [],
    "runtime_probe_ref": "rec-runtime-probe-receipt",
    "reservation": {
      "reservation_id": "res-1",
      "budget_ref": "bud-1",
      "amount": {
        "value": 64,
        "unit": "core-hour"
      }
    },
    "decision": "ADMITTED",
    "reasons": [
      "Exploratorio: NOT_ESTABLISHED visible."
    ],
    "expires_at": "2026-10-12T05:00:00Z",
    "preconditions": [
      {
        "kind": "PLAN_REVISION",
        "expected": "3"
      }
    ]
  },
  "native_contract_refs": [],
  "integrity": {
    "status": "UNVERIFIED",
    "canonicalization": "jcs-rfc8785",
    "algorithm": "sha-256",
    "digest": null
  }
}
