{
  "schema_id": "dftlab.controller-authority-record",
  "schema_version": "0.1.0",
  "record_id": "rec-controller-authority-record",
  "project_id": "prj-demo",
  "producer": {
    "package": "dftlab-platform",
    "version": "0.1.0",
    "commit": null,
    "algorithm": null
  },
  "created_at": "2026-10-11T05:00:00Z",
  "payload": {
    "run_id": "run-1",
    "attempt_id": "att-1",
    "owner_instance_id": "worker-a",
    "generation": 1,
    "fencing": {
      "mechanism": "NOT_SUPPORTED",
      "checked_at": "NONE"
    },
    "automatic_takeover": "DISABLED",
    "site_scope": "cluster-x",
    "lease_expires_at": "2026-10-11T06:00:00Z",
    "validity_evidence": [],
    "termination_evidence": []
  },
  "native_contract_refs": [],
  "integrity": {
    "status": "UNVERIFIED",
    "canonicalization": "jcs-rfc8785",
    "algorithm": "sha-256",
    "digest": null
  }
}
